filename,st_name,speaker,age,gender,text,arg0,arg1,metaphor_score
SD2022.txt,South Dakota,Noem_Kristi,50,1,"In fact, no Harley Davidson dealership ANYWHERE has ever seen the revenue that Black Hills Harley achieved in 2021.",achieve,that,.57230788
SD2022.txt,South Dakota,Noem_Kristi,50,1,The South Dakota people worked together to navigate the pandemic.,people,work,.42084798
SD2022.txt,South Dakota,Noem_Kristi,50,1,"Our rights come from God, NOT from government.",right,come,.58197707
SD2022.txt,South Dakota,Noem_Kristi,50,1,Aesir Technologies chose Rapid City as the location for their new Gigafactory after a nationwide search.,technologies,choose,.50018471
SD2022.txt,South Dakota,Noem_Kristi,50,1,"Since then, we have made tremendous progress.",tremendous,progress,.6240558
SD2022.txt,South Dakota,Noem_Kristi,50,1,"I am amazed by their efforts, and I am so grateful for how they have sacrificed to serve others.",they,sacrifice,.45984706
SD2022.txt,South Dakota,Noem_Kristi,50,1,"So far this fiscal year, we’re $116 million above ongoing legislative adopted estimates.",legislative,estimate,.52117449
SD2022.txt,South Dakota,Noem_Kristi,50,1,"Three years ago, I created the Governor’s Heroism Award to honor South Dakotans who went above and beyond.",who,go,.44854343
SD2022.txt,South Dakota,Noem_Kristi,50,1,We have one of the lowest unemployment rates in the United States.,low,rate,.66639906
SD2022.txt,South Dakota,Noem_Kristi,50,1,"We took steps to be safe, to guard public health.",take,step,.5398801
SD2022.txt,South Dakota,Noem_Kristi,50,1,"This past year, 262 South Dakota children found their forever families, and 135 children were placed into a legal guardianship.",past,year,.52166069
SD2022.txt,South Dakota,Noem_Kristi,50,1,"We have to teach them the true, honest history of our country.",teach,history,.6190775
SD2022.txt,South Dakota,Noem_Kristi,50,1,And GOVERNMENT must remain LIMITED to serve its proper role of securing those rights.,secure,right,.60011274
SD2022.txt,South Dakota,Noem_Kristi,50,1,"Last year, every single legislator supported my bill to guarantee protections for unborn children with Down syndrome.",unborn,child,.2104952
SD2022.txt,South Dakota,Noem_Kristi,50,1,"Unfortunately, our emergency responders are getting fewer and fewer.",responder,get,.28236884
SD2022.txt,South Dakota,Noem_Kristi,50,1,"In South Dakota, we will protect freedom.",protect,freedom,.79013622
SD2022.txt,South Dakota,Noem_Kristi,50,1,Would you all join me in giving Alyssa a round of applause?,give,round,.47191843
SD2022.txt,South Dakota,Noem_Kristi,50,1,We didn’t just keep the “open” sign on.,open,sign,.53581166
SD2022.txt,South Dakota,Noem_Kristi,50,1,"In order for us to defend liberty, government must remain limited.",government,remain,.61102295
SD2022.txt,South Dakota,Noem_Kristi,50,1,Their economies — their people — are paying the price.,pay,price,.34351754
SD2022.txt,South Dakota,Noem_Kristi,50,1,The issue has advanced to the United States Supreme Court and oral arguments were heard last week.,oral,argument,.50000185
SD2022.txt,South Dakota,Noem_Kristi,50,1,We didn’t just keep the “open” sign on.,keep,sign,.63402188
SD2022.txt,South Dakota,Noem_Kristi,50,1,Our systems monitored people from home to ensure their safety while keeping beds available.,ensure,safety,.51050365
SD2022.txt,South Dakota,Noem_Kristi,50,1,Businesses that have always called South Dakota home also expanded.,business,expand,.50413108
SD2022.txt,South Dakota,Noem_Kristi,50,1,We live in a free country – free to make our own decisions.,own,decision,.5219937
SD2022.txt,South Dakota,Noem_Kristi,50,1,"Today, you will hear more stories about the amazing people in our state who have faced and overcome adversity.",more,story,.53222692
SD2022.txt,South Dakota,Noem_Kristi,50,1,"President Reagan reminded us, “Freedom is never more than one generation away from extinction.",reagan,remind,.39344999
SD2022.txt,South Dakota,Noem_Kristi,50,1,I am introducing legislation that would allow for a moment of silence at the beginning of each school day.,that,allow,.48033732
SD2022.txt,South Dakota,Noem_Kristi,50,1,"And as she was driving home to Washington, she said “I don’t want to go back.",she,drive,.45543101
SD2022.txt,South Dakota,Noem_Kristi,50,1,North Sioux City is adding over 300 acres to their industrial park to host many businesses.,add,acre,.4545849
SD2022.txt,South Dakota,Noem_Kristi,50,1,Other states told people that they weren’t essential -- picked winners and losers.,state,tell,.55359644
SD2022.txt,South Dakota,Noem_Kristi,50,1,"We broke records for visitor spending, visits to our state parks, and so much more.",more,visit,.48566827
SD2022.txt,South Dakota,Noem_Kristi,50,1,"Since that time, we’ve received even more great news, which I’m prepared to share with you today.",receive,news,.45834544
SD2022.txt,South Dakota,Noem_Kristi,50,1,"Yet in our public schools, prayer is absent – forbidden.",public,school,.32463321
SD2022.txt,South Dakota,Noem_Kristi,50,1,Countless families made South Dakota their travel destination.,countless,family,.54651272
SD2022.txt,South Dakota,Noem_Kristi,50,1,Our systems monitored people from home to ensure their safety while keeping beds available.,system,monitor,.35558137
SD2022.txt,South Dakota,Noem_Kristi,50,1,South Dakota has been named the number one state in the nation for veterans to live and work.,veteran,live,.44087216
SD2022.txt,South Dakota,Noem_Kristi,50,1,We don’t teach our children to be divisive and organize them into separate groups based on skin color.,organize,they,.50895023
SD2022.txt,South Dakota,Noem_Kristi,50,1,"This past year, we had 443 volunteers log a total of 103,000 hours of service.",log,total,.44278389
SD2022.txt,South Dakota,Noem_Kristi,50,1,Could I ask our veterans to stand and join the others?,ask,veteran,.34034154
SD2022.txt,South Dakota,Noem_Kristi,50,1,North Sioux City is adding over 300 acres to their industrial park to host many businesses.,many,business,.51280588
SD2022.txt,South Dakota,Noem_Kristi,50,1,Thank you for your strength and for not giving up on your dream.,thank,you,.44988889
SD2022.txt,South Dakota,Noem_Kristi,50,1,We need to protect the freedom of our young girls to go out there and do it.,do,it,.46025267
SD2022.txt,South Dakota,Noem_Kristi,50,1,We will also recognize natural immunity.,recognize,immunity,.5317449
SD2022.txt,South Dakota,Noem_Kristi,50,1,We must act now to protect the American Dream – to preserve the pursuit of happiness for future generations.,protect,dream,.68411678
SD2022.txt,South Dakota,Noem_Kristi,50,1,It would be irresponsible to create or expand any ongoing programs with one-time dollars.,ongoing,program,.38784289
SD2022.txt,South Dakota,Noem_Kristi,50,1,"During the pandemic, South Dakota was Top 3 for smallest negative impact on female workers.",female,worker,.36433598
SD2022.txt,South Dakota,Noem_Kristi,50,1,I am hopeful you will support these projects.,support,project,.57771319
SD2022.txt,South Dakota,Noem_Kristi,50,1,"In order for us to defend liberty, government must remain limited.",defend,liberty,.70859337
SD2022.txt,South Dakota,Noem_Kristi,50,1,"Furniture Mart USA is doubling its campus in Sioux Falls, creating a 650,000 square foot facility.",usa,double,.53193641
SD2022.txt,South Dakota,Noem_Kristi,50,1,"They can win high school championships, maybe earn scholarships, maybe even go on to play professional sports.",professional,sport,.41619679
SD2022.txt,South Dakota,Noem_Kristi,50,1,They gave our firefighters and first responders free use of their facilities and didn’t ask for anything in return.,free,use,.43350184
SD2022.txt,South Dakota,Noem_Kristi,50,1,We also are one of the Top 10 Best States for Women to live and work.,woman,live,.45151606
SD2022.txt,South Dakota,Noem_Kristi,50,1,"South Dakota has joined four lawsuits against the Biden Administration's unconstitutional vaccine mandates, and we are winning in court.",unconstitutional,vaccine,.26935735
SD2022.txt,South Dakota,Noem_Kristi,50,1,"Since 2015, we have seen an increase of nearly 100,000 camping nights reserved throughout the state park system.",see,increase,.48554251
SD2022.txt,South Dakota,Noem_Kristi,50,1,"Our state’s motto is, “Under God the people rule.",people,rule,.36865905
SD2022.txt,South Dakota,Noem_Kristi,50,1,"It’s happening in the news, on TV, in social media, and with what is taught to our children.",social,medium,.69346845
SD2022.txt,South Dakota,Noem_Kristi,50,1,"Two years ago, we made a decision in the face of a global threat.",global,threat,.55630934
SD2022.txt,South Dakota,Noem_Kristi,50,1,The woman responded to Jessica by saying that there was no magic wand that could make her dream come true.,dream,come,.57592589
SD2022.txt,South Dakota,Noem_Kristi,50,1,Rodney and Peggy Anderson have adopted nine children out of the foster care system and have fostered many more.,foster,more,.56636077
SD2022.txt,South Dakota,Noem_Kristi,50,1,"Financially, we see the impact of protecting liberty in South Dakota, but unfortunately, personal liberties are under attack.",personal,liberty,.57737929
SD2022.txt,South Dakota,Noem_Kristi,50,1,"Three years ago, I created the Governor’s Heroism Award to honor South Dakotans who went above and beyond.",create,award,.63439775
SD2022.txt,South Dakota,Noem_Kristi,50,1,"In fact, all of the legislators have inspirational stories that led them to where they are today.",that,lead,.60691357
SD2022.txt,South Dakota,Noem_Kristi,50,1,My Department of Labor is eliminating barriers to employment.,eliminate,barrier,.4894354
SD2022.txt,South Dakota,Noem_Kristi,50,1,Healthcare workers in South Dakota have faced perhaps the greatest challenges of their career over these past two years.,face,challenge,.70118701
SD2022.txt,South Dakota,Noem_Kristi,50,1,Yet HUNDREDS of high school aged boys have run faster times than that.,fast,time,.54899031
SD2022.txt,South Dakota,Noem_Kristi,50,1,"During the pandemic, South Dakota was Top 3 for smallest negative impact on female workers.",negative,impact,.60051787
SD2022.txt,South Dakota,Noem_Kristi,50,1,Every citizen in South Dakota will have the access to get a free COVID test in their home community.,free,test,.45912746
SD2022.txt,South Dakota,Noem_Kristi,50,1,We brought this program to our state with legislation in 2019.,bring,program,.528853
SD2022.txt,South Dakota,Noem_Kristi,50,1,Their dedication to saving the lives of their fellow South Dakotans is inspirational.,save,life,.6886763
SD2022.txt,South Dakota,Noem_Kristi,50,1,To win such an honor twice is a testament to their hard work and training.,hard,work,.60448164
SD2022.txt,South Dakota,Noem_Kristi,50,1,We can thank our law enforcement agencies who are working to keep this poison off our streets.,keep,poison,.37497264
SD2022.txt,South Dakota,Noem_Kristi,50,1,"His story is the American Dream, and he followed it up with a career in public service.",public,service,.30011615
SD2022.txt,South Dakota,Noem_Kristi,50,1,"Finally, although we don’t have many taxes in South Dakota, I am proposing that we eliminate a ridiculous tax.",eliminate,tax,.77861708
SD2022.txt,South Dakota,Noem_Kristi,50,1,Our healthcare workers worked hard to keep us within our hospital capacity.,worker,work,.44272274
SD2022.txt,South Dakota,Noem_Kristi,50,1,Government’s most fundamental role is to defend the lives and safety of the people.,fundamental,role,.41192123
SD2022.txt,South Dakota,Noem_Kristi,50,1,Every other state in this country ordered some businesses to close.,state,order,.5099923
SD2022.txt,South Dakota,Noem_Kristi,50,1,"No matter where you live in our state, you should have access to the highest quality care available.",high,care,.59481567
SD2022.txt,South Dakota,Noem_Kristi,50,1,"Let’s thank them and every foster parent in this state for their tremendous, heroic efforts!",heroic,effort,.55454338
SD2022.txt,South Dakota,Noem_Kristi,50,1,Schools are where our children learn the consequences of making mistakes and the hard work of success.,make,mistake,.57560307
SD2022.txt,South Dakota,Noem_Kristi,50,1,Many people who moved here brought their businesses with them – big and small.,many,people,.40081227
SD2022.txt,South Dakota,Noem_Kristi,50,1,They go above and beyond – always putting the children in their home first.,they,go,.5209071
SD2022.txt,South Dakota,Noem_Kristi,50,1,We helped struggling families put food on the table or keep the lights on.,put,food,.49387273
SD2022.txt,South Dakota,Noem_Kristi,50,1,"That’s fantastic news, and we should return a portion of these strong revenues to the people of South Dakota.",fantastic,news,.54542619
SD2022.txt,South Dakota,Noem_Kristi,50,1,The Supreme Court has a historic opportunity to make that a reality.,that,reality,.49985465
SD2022.txt,South Dakota,Noem_Kristi,50,1,But I am introducing -- and hope you will support -- a bill that will be the strongest law in the nation.,strong,law,.79748321
SD2022.txt,South Dakota,Noem_Kristi,50,1,We have a fantastic army of volunteers who work at our parks each year.,who,work,.49188817
SD2022.txt,South Dakota,Noem_Kristi,50,1,Our South Dakota National Guard continues to demonstrate excellence.,demonstrate,excellence,.62062973
SD2022.txt,South Dakota,Noem_Kristi,50,1,We need to recruit more volunteer firefighters and emergency responders.,recruit,firefighter,.46501115
SD2022.txt,South Dakota,Noem_Kristi,50,1,That’s what it means to be South Dakotans.,mean,what,.46055576
SD2022.txt,South Dakota,Noem_Kristi,50,1,The Representatives and Senators in the SD Legislature truly do reflect the people of South Dakota.,reflect,people,.43150908
SD2022.txt,South Dakota,Noem_Kristi,50,1,"Government, at times, abuses its power and interferes with that liberty.",abuse,power,.76063049
SD2022.txt,South Dakota,Noem_Kristi,50,1,"Finally, although we don’t have many taxes in South Dakota, I am proposing that we eliminate a ridiculous tax.",ridiculous,tax,.55826831
SD2022.txt,South Dakota,Noem_Kristi,50,1,They’re improving water and soil quality and enhancing opportunities for all who enjoy the outdoors.,enjoy,outdoor,.5846318
SD2022.txt,South Dakota,Noem_Kristi,50,1,We are leading with strong schools.,strong,school,.71710885
SD2022.txt,South Dakota,Noem_Kristi,50,1,JAG is helping these students at risk of dropping out to achieve graduation and be ready for their futures.,help,student,.45700723
SD2022.txt,South Dakota,Noem_Kristi,50,1,"In South Dakota, we support and serve others.",serve,other,.55862087
SD2022.txt,South Dakota,Noem_Kristi,50,1,"Today, you will hear more stories about the amazing people in our state who have faced and overcome adversity.",who,face,.40175632
SD2022.txt,South Dakota,Noem_Kristi,50,1,"Last year, every single legislator supported my bill to guarantee protections for unborn children with Down syndrome.",legislator,support,.40097818
SD2022.txt,South Dakota,Noem_Kristi,50,1,I am hopeful you will support these projects.,you,support,.43860424
SD2022.txt,South Dakota,Noem_Kristi,50,1,She took a road trip to the Black Hills.,take,trip,.42640918
SD2022.txt,South Dakota,Noem_Kristi,50,1,"By the same token, they should learn from both America’s triumphs and our mistakes.",they,learn,.46606198
SD2022.txt,South Dakota,Noem_Kristi,50,1,Our way of life — our civil society — depends on the brave men and women of law enforcement.,way,depend,.44427666
SD2022.txt,South Dakota,Noem_Kristi,50,1,"No matter where you live in our state, you should have access to the highest quality care available.",available,care,.28138357
SD2022.txt,South Dakota,Noem_Kristi,50,1,"Our state is top-3 in the nation for inbound migration, according to United Van Lines.",inbound,migration,.45705035
SD2022.txt,South Dakota,Noem_Kristi,50,1,"Because we trusted in liberty, people chose to visit our state by the millions.",people,choose,.40755528
SD2022.txt,South Dakota,Noem_Kristi,50,1,It rejects the American Dream.,reject,dream,.49038994
SD2022.txt,South Dakota,Noem_Kristi,50,1,And South Dakota’s jobs market continues to be a national leader as a result.,national,leader,.46051833
SD2022.txt,South Dakota,Noem_Kristi,50,1,We have to make sure our children know America’s promise.,know,promise,.56738257
SD2022.txt,South Dakota,Noem_Kristi,50,1,"For years, emergency services in small towns across South Dakota have been largely run by volunteers.",small,town,.34142745
SD2022.txt,South Dakota,Noem_Kristi,50,1,That includes the rights and the lives of unborn children.,that,include,.51193649
SD2022.txt,South Dakota,Noem_Kristi,50,1,It would be irresponsible to create or expand any ongoing programs with one-time dollars.,expand,program,.43903452
SD2022.txt,South Dakota,Noem_Kristi,50,1,"The Second Century Initiative has benefitted hunters, while also supporting our farmers and ranchers.",benefit,hunter,.40454215
SD2022.txt,South Dakota,Noem_Kristi,50,1,"Government, at times, abuses its power and interferes with that liberty.",government,abuse,.44156024
SD2022.txt,South Dakota,Noem_Kristi,50,1,It helps preserve our state’s status as a top destination for pheasant hunting.,preserve,status,.52906853
SD2022.txt,South Dakota,Noem_Kristi,50,1,"The world economy is changing, too.",economy,change,.56207526
SD2022.txt,South Dakota,Noem_Kristi,50,1,They won that award again in 2020.,win,award,.5772059
SD2022.txt,South Dakota,Noem_Kristi,50,1,"In the Preamble to our state’s Constitution, we express gratitude “to Almighty God for our civil and religious liberties.",express,gratitude,.38181835
SD2022.txt,South Dakota,Noem_Kristi,50,1,But never in our history have we seen government shut down liberty as we saw during the pandemic.,shut,liberty,.6892817
SD2022.txt,South Dakota,Noem_Kristi,50,1,They’re improving water and soil quality and enhancing opportunities for all who enjoy the outdoors.,improve,water,.48132277
SD2022.txt,South Dakota,Noem_Kristi,50,1,We take care of our natural resources because we want them to be available for our kids and grandkids.,natural,resource,.4647882
SD2022.txt,South Dakota,Noem_Kristi,50,1,"Today, I am asking all of you to protect the heartbeats of these unborn children.",protect,heartbeat,.63555002
SD2022.txt,South Dakota,Noem_Kristi,50,1,It will not cost you a penny to exercise your Second Amendment rights in South Dakota.,it,cost,.53138578
SD2022.txt,South Dakota,Noem_Kristi,50,1,"This past year, we had 443 volunteers log a total of 103,000 hours of service.",volunteer,log,.28402817
SD2022.txt,South Dakota,Noem_Kristi,50,1,Would you all join me in giving Alyssa a round of applause?,you,join,.54702026
SD2022.txt,South Dakota,Noem_Kristi,50,1,I am so grateful for all those folks who volunteer to welcome people who visit our state parks.,visit,park,.39131474
SD2022.txt,South Dakota,Noem_Kristi,50,1,Another way that we can advance life in South Dakota is by giving our people healthcare options close to home.,give,option,.47560334
SD2022.txt,South Dakota,Noem_Kristi,50,1,We need to protect the freedom of our young girls to go out there and do it.,protect,freedom,.79013622
SD2022.txt,South Dakota,Noem_Kristi,50,1,"As for mental health, my budget creates regional behavioral crisis centers.",regional,center,.4848102
SD2022.txt,South Dakota,Noem_Kristi,50,1,And they’re preparing to build 300 new career homes to support that growth.,new,home,.43801481
SD2022.txt,South Dakota,Noem_Kristi,50,1,Chemical abortions happen when a woman ends an unborn life with a pill.,woman,end,.50578666
SD2022.txt,South Dakota,Noem_Kristi,50,1,They gave our firefighters and first responders free use of their facilities and didn’t ask for anything in return.,give,use,.48178634
SD2022.txt,South Dakota,Noem_Kristi,50,1,"She had to wear a mask everywhere she went, even when other people weren’t around.",other,people,.40946886
SD2022.txt,South Dakota,Noem_Kristi,50,1,They’ll create 400 new good-paying high-tech jobs in the process.,high,tech,.56028968
SD2022.txt,South Dakota,Noem_Kristi,50,1,North Sioux City is adding over 300 acres to their industrial park to host many businesses.,industrial,park,.33345136
SD2022.txt,South Dakota,Noem_Kristi,50,1,"For over a year, we have offered free at-home COVID tests to the people of South Dakota.",free,test,.45912746
SD2022.txt,South Dakota,Noem_Kristi,50,1,The issue has advanced to the United States Supreme Court and oral arguments were heard last week.,last,week,.45995244
SD2022.txt,South Dakota,Noem_Kristi,50,1,They’re coming here because they want to be like us.,they,want,.43335596
SD2022.txt,South Dakota,Noem_Kristi,50,1,"While places like California, New York, and Washington, D. C. are LOSING population.",lose,population,.60465294
SD2022.txt,South Dakota,Noem_Kristi,50,1,Could I ask our veterans to stand and join the others?,join,other,.58551937
SD2022.txt,South Dakota,Noem_Kristi,50,1,We will not allow freedom to go extinct.,freedom,go,.62370449
SD2022.txt,South Dakota,Noem_Kristi,50,1,These centers will help us get people appropriate care more quickly and close to home.,people,appropriate,.3211765
SD2022.txt,South Dakota,Noem_Kristi,50,1,We have partnered with Dakota State University to create a Future Workforce Finder tool.,create,tool,.40624228
SD2022.txt,South Dakota,Noem_Kristi,50,1,They’ve dealt with childhood trauma and connected their foster kids with professionals to help them.,they,deal,.50408489
SD2022.txt,South Dakota,Noem_Kristi,50,1,They fell in love with South Dakota.,they,fall,.51624894
SD2022.txt,South Dakota,Noem_Kristi,50,1,I am so grateful for all those folks who volunteer to welcome people who visit our state parks.,who,volunteer,.42537922
SD2022.txt,South Dakota,Noem_Kristi,50,1,Healthcare workers in South Dakota have faced perhaps the greatest challenges of their career over these past two years.,worker,face,.40996045
SD2022.txt,South Dakota,Noem_Kristi,50,1,Other states took a different course.,different,course,.42671081
SD2022.txt,South Dakota,Noem_Kristi,50,1,We are seeing inspirational testimonies from women like our very own State Senator Jessica Castleberry.,see,testimony,.43256584
SD2022.txt,South Dakota,Noem_Kristi,50,1,And they’re preparing to build 300 new career homes to support that growth.,support,growth,.73743272
SD2022.txt,South Dakota,Noem_Kristi,50,1,"Many have gotten older, and less people are stepping up to volunteer.",people,step,.41381997
SD2022.txt,South Dakota,Noem_Kristi,50,1,"Fed up with the “ever-changing rules,” as she describes it.",describe,it,.55126476
SD2022.txt,South Dakota,Noem_Kristi,50,1,"Let’s thank them and every foster parent in this state for their tremendous, heroic efforts!",thank,they,.41226071
SD2022.txt,South Dakota,Noem_Kristi,50,1,Our state supports opportunity for all.,state,support,.52434444
SD2022.txt,South Dakota,Noem_Kristi,50,1,And any abortion after that point stops that heartbeat — stops that life — stops that gift from God.,stop,gift,.42723104
SD2022.txt,South Dakota,Noem_Kristi,50,1,They’ll create 400 new good-paying high-tech jobs in the process.,they,create,.52549249
SD2022.txt,South Dakota,Noem_Kristi,50,1,It divides us based on the color of our skin.,it,divide,.40711719
SD2022.txt,South Dakota,Noem_Kristi,50,1,It will not cost you a penny to exercise your Second Amendment rights in South Dakota.,exercise,right,.55480552
SD2022.txt,South Dakota,Noem_Kristi,50,1,They answer calls across Sully County.,they,answer,.42567855
SD2022.txt,South Dakota,Noem_Kristi,50,1,That didn’t happen here.,that,happen,.43977186
SD2022.txt,South Dakota,Noem_Kristi,50,1,"For example, Hanson High School hosted 40 guest speakers representing 16 different career areas.",different,area,.40507716
SD2022.txt,South Dakota,Noem_Kristi,50,1,"They can win high school championships, maybe earn scholarships, maybe even go on to play professional sports.",they,win,.52423793
SD2022.txt,South Dakota,Noem_Kristi,50,1,The government does not get to make them for us.,government,get,.53311139
SD2022.txt,South Dakota,Noem_Kristi,50,1,"Today, you will hear more stories about the amazing people in our state who have faced and overcome adversity.",you,hear,.42301351
SD2022.txt,South Dakota,Noem_Kristi,50,1,"We are free here in South Dakota, but we cannot take that freedom for-granted.",take,freedom,.51778501
SD2022.txt,South Dakota,Noem_Kristi,50,1,Freedom and Liberty are about self-determination and the right to achieve — to reach our fullest potential.,reach,potential,.62322235
SD2022.txt,South Dakota,Noem_Kristi,50,1,Albany Farms moved the headquarters of its food manufacturing operations from Los Angeles to Belle Fourche.,farms,move,.47257212
SD2022.txt,South Dakota,Noem_Kristi,50,1,"To our nurses, doctors, and healthcare professionals: we are getting you more help.",you,help,.54228961
SD2022.txt,South Dakota,Noem_Kristi,50,1,People want to live somewhere that respects them – that respects their freedoms.,respect,they,.46346071
SD2022.txt,South Dakota,Noem_Kristi,50,1,"As soon as Roe v. Wade is overturned, our state laws are ready to protect every unborn South Dakota child.",unborn,child,.2104952
SD2022.txt,South Dakota,Noem_Kristi,50,1,"Three years ago, Constitutional Carry was the very first bill that I signed as Governor.",first,bill,.51592386
SD2022.txt,South Dakota,Noem_Kristi,50,1,"It isn’t long before they have their own unique heartbeat, too.",unique,heartbeat,.55494231
SD2022.txt,South Dakota,Noem_Kristi,50,1,This is largely a tax on our elderly populations and veterans.,elderly,population,.45345238
SD2022.txt,South Dakota,Noem_Kristi,50,1,"While overdoses have been skyrocketing across the country, in South Dakota, overdose deaths dropped by 19 percent.",death,drop,.70353037
SD2022.txt,South Dakota,Noem_Kristi,50,1,"We have to teach them the true, honest history of our country.",true,history,.59895408
